{
  "schema_version": "1.0.0",
  "certificate_type": "URF-SG",
  "invariants": [
    {
      "name": "FOk Refinement Wall",
      "statement": "FO^k-admissible refinement processes have entropy depth Theta(n)",
      "regime": "deterministic"
    }
  ],
  "evidence": {
    "artifacts": [
      {
        "path": "tests/artifacts/example.txt",
        "sha256": "f3ab28aaa17417e3cf92002fa7a86f0b2989c5e6f44cc27ea4be015a532571f1"
      }
    ],
    "verifier_commit": "main"
  },
  "hashes": {
    "certificate_sha256": "0000000000000000000000000000000000000000000000000000000000000000"
  }
}

